{
  "id": "V4-E01",
  "volume_id": "V4",
  "sequence": 1,
  "objective": "북부 고봉의 험난한 환경을 극복하며 성소로 향한다.",
  "start_state": {
    "status": "환상통 극복"
  },
  "end_state": {
    "status": "성소 외곽 도착"
  },
  "scene_ids": [
    "V4-E01-S01",
    "V4-E01-S02",
    "V4-E01-S03",
    "V4-E01-S04",
    "V4-E01-S05",
    "V4-E01-S06"
  ]
}
