{
  "id": "V2-E02",
  "volume_id": "V2",
  "sequence": 2,
  "objective": "기억의 닻을 이용해 하층민의 신뢰를 얻으려 하지만, 등가교환의 법칙으로 인한 비극을 겪으며 도덕적 딜레마에 빠진다.",
  "start_state": {
    "location": "녹슨 심장 거주구",
    "knowledge": "기억 추출 장치의 존재"
  },
  "end_state": {
    "result": "등가교환의 기록 법칙 확인(C8)",
    "relation": "하층민들의 복합적인 증오와 의존"
  },
  "scene_ids": [
    "V2-E02-S01",
    "V2-E02-S02",
    "V2-E02-S03",
    "V2-E02-S04",
    "V2-E02-S05"
  ]
}
