{
  "id": "V3-E02",
  "volume_id": "V3",
  "sequence": 2,
  "objective": "상아탑의 물리적, 계급적 장벽을 돌파하며 도시의 기억 독점 구조와 그 추악한 작동 방식을 목격한다.",
  "start_state": {
    "rian": "이클립스의 일원으로서 상아탑 침투 계획에 참여함",
    "elara": "이클립스의 극단적 목적과 자신의 기록자로서의 사명 사이에서 갈등함"
  },
  "end_state": {
    "rian": "상아탑의 심장부인 중앙 저장소 입구에 도달함",
    "elara": "지배층이 누리는 기억의 풍요가 하층민의 고통 위에 세워졌음을 확인함"
  },
  "scene_ids": [
    "V3-E02-S01",
    "V3-E02-S02",
    "V3-E02-S03",
    "V3-E02-S04",
    "V3-E02-S05",
    "V3-E02-S06"
  ]
}
