{
  "id": "V2-E04",
  "volume_id": "V2",
  "sequence": 4,
  "objective": "로드 발레리우스와 대면하여 의회의 통제 논리에 맞서고, 생존과 진실 추적을 위해 위험한 이중 첩자 계약을 맺는다.",
  "start_state": {
    "location": "코어 진입로",
    "knowledge": "코어의 물리적 위치"
  },
  "end_state": {
    "status": "의회의 이중 첩자"
  },
  "scene_ids": [
    "V2-E04-S01",
    "V2-E04-S02",
    "V2-E04-S03",
    "V2-E04-S04",
    "V2-E04-S05",
    "V2-E04-S06",
    "V2-E04-S07"
  ]
}
