{
  "id": "V5-E03",
  "volume_id": "V5",
  "sequence": 3,
  "objective": "기억 엔진의 파괴와 그로 인한 오볼루스 시의 문명적 전환을 묘사한다.",
  "start_state": {
    "rian": "모든 기억의 집합체이자 동시에 아무것도 아닌 존재가 됨",
    "elara": "완전한 망각과 함께 구원받음"
  },
  "end_state": {
    "rian": "백색 도서관의 깊은 곳에 안착함",
    "elara": "자신의 손끝에서 느껴지는 시간의 흐름과 생명력을 깨달음"
  },
  "scene_ids": [
    "V5-E03-S01",
    "V5-E03-S02",
    "V5-E03-S03",
    "V5-E03-S04",
    "V5-E03-S05"
  ]
}
