{
  "id": "V2-E03",
  "volume_id": "V2",
  "sequence": 3,
  "objective": "클락워크 센티넬의 감시를 뚫고 기억 전송 튜브를 추적하여 에테르 코어의 물리적 위치와 진실에 도달한다.",
  "start_state": {
    "result": "등가교환의 기록 법칙 확인(C8)",
    "relation": "하층민들의 복합적인 증오와 의존"
  },
  "end_state": {
    "location": "코어 진입로",
    "knowledge": "코어의 물리적 위치"
  },
  "scene_ids": [
    "V2-E03-S01",
    "V2-E03-S02",
    "V2-E03-S03",
    "V2-E03-S04",
    "V2-E03-S05"
  ]
}
