{
  "id": "V4-E02",
  "volume_id": "V4",
  "sequence": 2,
  "objective": "금지된 기록 구역에서 에테르가르드의 진정한 기원과 설계자의 의도를 추적한다.",
  "start_state": {
    "result": "금지된 서고 진입 경로 확보"
  },
  "end_state": {
    "result": "코어 무력화 단서 확보"
  },
  "scene_ids": [
    "V4-E02-S01",
    "V4-E02-S02",
    "V4-E02-S03",
    "V4-E02-S04",
    "V4-E02-S05"
  ]
}
