{
  "id": "V1-E02",
  "volume_id": "V1",
  "sequence": 2,
  "objective": "기억 밀수 의뢰를 통해 오볼루스의 기억 경제 체제와 계급 간의 극심한 격차를 보여준다.",
  "start_state": {
    "rian": "임시 정체성을 부여받고 일상으로 복귀함",
    "elara": "리안의 정신적 의존도를 확인하며 보호 본능을 느낌"
  },
  "end_state": {
    "rian": "기억 추출의 비인간적인 면모에 혐오감을 느낌",
    "elara": "도시의 시스템에 대한 근본적인 의문을 품기 시작함"
  },
  "scene_ids": [
    "V1-E02-S01",
    "V1-E02-S02",
    "V1-E02-S03",
    "V1-E02-S04",
    "V1-E02-S05"
  ]
}
