{
  "id": "V1-E03",
  "volume_id": "V1",
  "sequence": 3,
  "objective": "금지된 구역으로의 조사를 통해 공허수의 위협을 실체화하고 리안의 신체적 특이성을 시험한다.",
  "start_state": {
    "rian": "기억 추출의 비인간적인 면모에 혐오감을 느낌",
    "elara": "도시의 시스템에 대한 근본적인 의문을 품기 시작함"
  },
  "end_state": {
    "rian": "자신의 존재가 단순한 결함 이상의 무언가임을 직감함",
    "elara": "리안을 잃을지도 모른다는 공포와 함께 그를 지키려는 의지를 다짐"
  },
  "scene_ids": [
    "V1-E03-S01",
    "V1-E03-S02",
    "V1-E03-S03",
    "V1-E03-S04",
    "V1-E03-S05"
  ]
}
