{
  "id": "V5-E02",
  "volume_id": "V5",
  "sequence": 2,
  "objective": "발레리우스의 질서와 설계자의 망각 사이에서 기억의 진정한 가치를 정의하고 제3의 길을 모색한다.",
  "start_state": {
    "item": "E_HOPE_FRAG 획득"
  },
  "end_state": {
    "decision": "기억의 공유와 해방 결정"
  },
  "scene_ids": [
    "V5-E02-S01",
    "V5-E02-S02",
    "V5-E02-S03",
    "V5-E02-S04",
    "V5-E02-S05"
  ]
}
