{
  "id": "V4-E03",
  "volume_id": "V4",
  "sequence": 3,
  "objective": "에테르 코어의 심층부로 하강하며 코어의 포식성과 자신의 신체적 위질감을 발견한다.",
  "start_state": {
    "result": "코어 무력화 단서 확보"
  },
  "end_state": {
    "result": "정체성 붕괴의 시작"
  },
  "scene_ids": [
    "V4-E03-S01",
    "V4-E03-S02",
    "V4-E03-S03",
    "V4-E03-S04",
    "V4-E03-S05"
  ]
}
